{
  "bundle_id": "timit_FDHC0",
  "utterance_summaries": [
    {
      "utt_id": "FDHC0_SA1",
      "long_word_count": 0,
      "short_word_count": 1,
      "inter_word_gap_count": 1,
      "boundary_gap_count": 1,
      "long_phone_count": 0,
      "short_phone_count": 0,
      "closure_count": 4,
      "pause_silence_count": 1,
      "glottal_stop_count": 0,
      "total_event_count": 8
    },
    {
      "utt_id": "FDHC0_SA2",
      "long_word_count": 0,
      "short_word_count": 1,
      "inter_word_gap_count": 1,
      "boundary_gap_count": 1,
      "long_phone_count": 0,
      "short_phone_count": 0,
      "closure_count": 3,
      "pause_silence_count": 1,
      "glottal_stop_count": 2,
      "total_event_count": 9
    },
    {
      "utt_id": "FDHC0_SI1559",
      "long_word_count": 2,
      "short_word_count": 0,
      "inter_word_gap_count": 0,
      "boundary_gap_count": 2,
      "long_phone_count": 0,
      "short_phone_count": 0,
      "closure_count": 0,
      "pause_silence_count": 0,
      "glottal_stop_count": 0,
      "total_event_count": 4
    },
    {
      "utt_id": "FDHC0_SI2189",
      "long_word_count": 0,
      "short_word_count": 0,
      "inter_word_gap_count": 0,
      "boundary_gap_count": 2,
      "long_phone_count": 0,
      "short_phone_count": 0,
      "closure_count": 0,
      "pause_silence_count": 0,
      "glottal_stop_count": 0,
      "total_event_count": 2
    },
    {
      "utt_id": "FDHC0_SI929",
      "long_word_count": 1,
      "short_word_count": 0,
      "inter_word_gap_count": 3,
      "boundary_gap_count": 2,
      "long_phone_count": 0,
      "short_phone_count": 0,
      "closure_count": 2,
      "pause_silence_count": 0,
      "glottal_stop_count": 3,
      "total_event_count": 11
    }
  ],
  "events": [
    {
      "utt_id": "FDHC0_SA1",
      "event_type": "boundary_gap",
      "start": 0.0,
      "end": 0.150625,
      "word_index": 0
    },
    {
      "utt_id": "FDHC0_SA1",
      "event_type": "closure_segment",
      "start": 0.51,
      "end": 0.5475,
      "phone_index": 5,
      "word_index": 1
    },
    {
      "utt_id": "FDHC0_SA1",
      "event_type": "short_word",
      "start": 0.5475,
      "end": 0.6575,
      "word_index": 2
    },
    {
      "utt_id": "FDHC0_SA1",
      "event_type": "closure_segment",
      "start": 0.6575,
      "end": 0.70375,
      "phone_index": 8,
      "word_index": 3
    },
    {
      "utt_id": "FDHC0_SA1",
      "event_type": "closure_segment",
      "start": 0.8825,
      "end": 0.939375,
      "phone_index": 12,
      "word_index": 3
    },
    {
      "utt_id": "FDHC0_SA1",
      "event_type": "closure_segment",
      "start": 1.2291875,
      "end": 1.261875,
      "phone_index": 16,
      "word_index": 4
    },
    {
      "utt_id": "FDHC0_SA1",
      "event_type": "inter_word_gap",
      "start": 2.107,
      "end": 2.14,
      "word_index": 3
    },
    {
      "utt_id": "FDHC0_SA1",
      "event_type": "pause_silence_segment",
      "start": 2.107,
      "end": 2.14,
      "phone_index": 29
    },
    {
      "utt_id": "FDHC0_SA2",
      "event_type": "glottal_stop",
      "start": 0.4375,
      "end": 0.488125,
      "phone_index": 4,
      "word_index": 0
    },
    {
      "utt_id": "FDHC0_SA2",
      "event_type": "glottal_stop",
      "start": 0.488125,
      "end": 0.488125,
      "phone_index": 4,
      "word_index": 0
    },
    {
      "utt_id": "FDHC0_SA2",
      "event_type": "inter_word_gap",
      "start": 0.7475,
      "end": 0.785,
      "word_index": 1
    },
    {
      "utt_id": "FDHC0_SA2",
      "event_type": "pause_silence_segment",
      "start": 0.7475,
      "end": 0.785,
      "phone_index": 7
    },
    {
      "utt_id": "FDHC0_SA2",
      "event_type": "short_word",
      "start": 0.785,
      "end": 0.86,
      "word_index": 2
    },
    {
      "utt_id": "FDHC0_SA2",
      "event_type": "closure_segment",
      "start": 0.9325,
      "end": 0.98125,
      "phone_index": 12,
      "word_index": 4
    },
    {
      "utt_id": "FDHC0_SA2",
      "event_type": "closure_segment",
      "start": 1.8524375,
      "end": 1.899375,
      "phone_index": 24,
      "word_index": 7
    },
    {
      "utt_id": "FDHC0_SA2",
      "event_type": "closure_segment",
      "start": 2.0575,
      "end": 2.130625,
      "phone_index": 28,
      "word_index": 8
    },
    {
      "utt_id": "FDHC0_SA2",
      "event_type": "boundary_gap",
      "start": 2.4673125,
      "end": 2.62,
      "word_index": 9
    },
    {
      "utt_id": "FDHC0_SI1559",
      "event_type": "boundary_gap",
      "start": 0.0,
      "end": 0.1325,
      "word_index": 0
    },
    {
      "utt_id": "FDHC0_SI1559",
      "event_type": "long_word",
      "start": 0.8375,
      "end": 1.6181875,
      "word_index": 2
    },
    {
      "utt_id": "FDHC0_SI1559",
      "event_type": "long_word",
      "start": 2.67,
      "end": 3.2625,
      "word_index": 8
    },
    {
      "utt_id": "FDHC0_SI1559",
      "event_type": "boundary_gap",
      "start": 3.2625,
      "end": 3.395,
      "word_index": 8
    },
    {
      "utt_id": "FDHC0_SI2189",
      "event_type": "boundary_gap",
      "start": 0.0,
      "end": 0.135,
      "word_index": 0
    },
    {
      "utt_id": "FDHC0_SI2189",
      "event_type": "boundary_gap",
      "start": 2.1175,
      "end": 2.25,
      "word_index": 6
    },
    {
      "utt_id": "FDHC0_SI929",
      "event_type": "boundary_gap",
      "start": 0.0,
      "end": 0.134375,
      "word_index": 0
    },
    {
      "utt_id": "FDHC0_SI929",
      "event_type": "long_word",
      "start": 0.6225,
      "end": 1.091375,
      "word_index": 2
    },
    {
      "utt_id": "FDHC0_SI929",
      "event_type": "glottal_stop",
      "start": 1.091375,
      "end": 1.15,
      "phone_index": 15
    },
    {
      "utt_id": "FDHC0_SI929",
      "event_type": "inter_word_gap",
      "start": 1.091375,
      "end": 1.15,
      "word_index": 2
    },
    {
      "utt_id": "FDHC0_SI929",
      "event_type": "glottal_stop",
      "start": 1.4020625,
      "end": 1.4405625,
      "phone_index": 18
    },
    {
      "utt_id": "FDHC0_SI929",
      "event_type": "inter_word_gap",
      "start": 1.4020625,
      "end": 1.4405625,
      "word_index": 3
    },
    {
      "utt_id": "FDHC0_SI929",
      "event_type": "inter_word_gap",
      "start": 1.5975,
      "end": 1.5975,
      "word_index": 5
    },
    {
      "utt_id": "FDHC0_SI929",
      "event_type": "closure_segment",
      "start": 1.5975,
      "end": 1.66375,
      "phone_index": 23,
      "word_index": 6
    },
    {
      "utt_id": "FDHC0_SI929",
      "event_type": "closure_segment",
      "start": 2.0469375,
      "end": 2.0730625,
      "phone_index": 27,
      "word_index": 6
    },
    {
      "utt_id": "FDHC0_SI929",
      "event_type": "glottal_stop",
      "start": 2.0954375,
      "end": 2.158,
      "phone_index": 29,
      "word_index": 7
    },
    {
      "utt_id": "FDHC0_SI929",
      "event_type": "boundary_gap",
      "start": 2.7235,
      "end": 2.855,
      "word_index": 7
    }
  ],
  "unlinked_events": [
    {
      "utt_id": "FDHC0_SA1",
      "event_type": "pause_silence_segment",
      "reason": "no_parent_word",
      "phone_index": 29
    },
    {
      "utt_id": "FDHC0_SA2",
      "event_type": "pause_silence_segment",
      "reason": "no_parent_word",
      "phone_index": 7
    },
    {
      "utt_id": "FDHC0_SI929",
      "event_type": "glottal_stop",
      "reason": "no_parent_word",
      "phone_index": 15
    },
    {
      "utt_id": "FDHC0_SI929",
      "event_type": "glottal_stop",
      "reason": "no_parent_word",
      "phone_index": 18
    }
  ]
}